{
  "group_id": "inv_LG28_INV_001_HOM_INV",
  "cohort_id": "main_226_hatchery",
  "label": "HOM_INV carriers for LG28_INV_001",
  "members": ["CGA001", "CGA007", "CGA012", "CGA042", "CGA071", "CGA118", "CGA133", "CGA189"],
  "n_members": 8,
  "dimension": "karyotype",
  "candidate_id": "LG28_INV_001",
  "status": "active",
  "created_at": "2026-04-15T14:23:00Z"
}
